id,path,ex1,ex2,allwordsp01,create novel ways for visual artists to express themselves and display their work,"Use it as a canvas for art, as it reacts to touch.","It would be great for making a canvas for artists that can then change based on how the artist programs it - different things appear at a different time of day, for example.","create novel ways for visual artists to express themselves and display their work Use it as a canvas for art, as it reacts to touch. It would be great for making a canvas for artists that can then change based on how the artist programs it - different things appear at a different time of day, for example."p03,enhance the customer experience at restaurants,chef coats could display food images of the menu they offer. same for the waiters at a restaurant,Interactive menus at restaurants - press to learn more about an item,enhance the customer experience at restaurants chef coats could display food images of the menu they offer. same for the waiters at a restaurant Interactive menus at restaurants - press to learn more about an itemp04,enhance the educational experience of students inside and outside the classroom,It can be used in school as a way to show kids how different climates in different places might feel,Interactive text books for students,enhance the educational experience of students inside and outside the classroom It can be used in school as a way to show kids how different climates in different places might feel Interactive text books for studentsp05,increase productivity/efficiency in everyday life,"a shirt that you can load data into the sleeve on, in case you need notes about something later",ability to write notes on clothes with touch sense,"increase productivity/efficiency in everyday life a shirt that you can load data into the sleeve on, in case you need notes about something later ability to write notes on clothes with touch sense"p06,make and display more effective advertisements in stores and in the general public,Airplane draggable banner that can display anything,Personalized billboards from companies that reflect changes in weather,make and display more effective advertisements in stores and in the general public Airplane draggable banner that can display anything Personalized billboards from companies that reflect changes in weatherp10,make physically interactive games for the entertainment for adults and/or of children,Make soft interactive baby toys that are safe for use even when parents aren't around,Dance floor carpet that flashes the next foot print spot after dancer hits appropriate spot,make physically interactive games for the entertainment for adults and/or of children Make soft interactive baby toys that are safe for use even when parents aren't around Dance floor carpet that flashes the next foot print spot after dancer hits appropriate spot